id,name,desc,stage_id
,,,
1,灵兔毛,灵性充沛的兔子细毛，质地柔软温暖，适合编织防寒衣物,1
2,魔狼牙,凶猛魔狼的锋利狼牙，蕴含魔力，是锻造利器的珍贵材料,2
3,青云鹿角,青云鹿的羼玉之角，蕴含清灵之气，是炼丹的上品药材,1
4,暗影豹爪,暗影豹的锋利爪子，轻盈而德，能增强武器的敏捷度,2
5,龙龟甲片,碧海龙龟的古老甲片，坚不可摧，蕴含海洋灵力，是顶级防具材料,3
6,山熊胆,石甲山熊的珍贵熊胆，能增强体质和力量，是体修者的珍贵药材,2
7,风速马鬃,风速马的飘逸鬃毛，轻如风羽，能用于炼制速度类法器,2
8,熔岩鳞片,熔岩蜥蜴的赤红鳞片，耐高温且蕴含火系灵力，是火属性法器的核心材料,3
9,毒瘴囊,毒瘴蛙的毒素囊袋，内含剧毒，是炼制毒类丹药的稀有材料,2
10,奇草精华,奇草提炼的精华，具有神奇的治愈效果,1
11,灵木心,灵木的珍贵木心，蕴含浓郁灵力，是制作法器的核心材料,2
12,仙人掌刺,沙漠仙人掌的灵药刻刺，能解百毒，制成针剂后效果显著,1
13,雪莲花瓣,寒霜雪莲的洁白花瓣，蕴含极寒之气，是寒性药材的最佳选择,2
14,灵芝孢子,水灵芝的蓝色孢子，能增强水行修炼者的灵力流通,2
15,雪绒花蕊,雪绒花的纯白花蕊，具有安神镇静功效，是冥想辅助的理想药材,1
16,古松松脂,千年古松的珍贵松脂，晶莹如琥珀，蕴含浓郁灵力，是高级炼器的稀有材料,3
17,灵稻精华,五谷灵稻提炼的精华，能快速强化体质，是体修丹药的主要成分,1